<?xml version="1.0" encoding="utf-8"?>
<?xml-stylesheet type="text/xsl" href="../xsl/article.xsl"?>
<!DOCTYPE blog SYSTEM "http://ferruck.github.io/dtd/article.dtd">
<article>
	<published>17.01.2014</published>
	<name>Numix GTK 3 Flat Theme Light Review</name>
	<text>Seit ein paar Tagen sind die neuen Flat-Themes von Numix im Software Center und auf deviantART als normale, helle und dunkle Version erhältlich. Ich habe mir die helle Version zugelegt und möchte hier kurz meine Meinung dazu abgeben.</text>
	<long>Lorem ipsum dolor sit amet, consetetur sadipscing elitr, sed diam nonumyeirmod tempor invidunt ut labore et dolore magna aliquyam erat, sed diamvoluptua. At vero eos et accusam et justo duo dolores et ea rebum. Stet clita kasd gubergren, no sea takimata sanctus est Lorem ipsum dolor sit amet.Lorem ipsum dolor sit amet, consetetur sadipscing elitr, sed diam nonumyeirmod tempor invidunt ut labore et dolore magna aliquyam erat, sed diamvoluptua. At vero eos et accusam et justo duo dolores et ea rebum. Stet clita kasd gubergren, no sea takimata sanctus est Lorem ipsum dolor sit amet.Lorem ipsum dolor sit amet, consetetur sadipscing elitr, sed diam nonumyeirmod tempor invidunt ut labore et dolore magna aliquyam erat, sed diamvoluptua. At vero eos et accusam et justo duo dolores et ea rebum. Stet clita kasd gubergren, no sea takimata sanctus est Lorem ipsum dolor sit amet.Lorem ipsum dolor sit amet, consetetur sadipscing elitr, sed diam nonumyeirmod tempor invidunt ut labore et dolore magna aliquyam erat, sed diamvoluptua. At vero eos et accusam et justo duo dolores et ea rebum. Stet clita kasd gubergren, no sea takimata sanctus est Lorem ipsum dolor sit amet.Lorem ipsum dolor sit amet, consetetur sadipscing elitr, sed diam nonumyeirmod tempor invidunt ut labore et dolore magna aliquyam erat, sed diamvoluptua. At vero eos et accusam et justo duo dolores et ea rebum. Stet clita kasd gubergren, no sea takimata sanctus est Lorem ipsum dolor sit amet.Lorem ipsum dolor sit amet, consete</long>
	<link>articles/numix_gtk_flat_theme_review.xml</link>
	<tag>flat</tag>
	<tag>gtk</tag>
	<tag>numix</tag>
	<tag>review</tag>
</article>
